{
  "contract": { "name": "qa-generate/generation-result", "version": "1.0.0" },
  "skill": { "name": "qa-generate", "version": "0.2.0" },
  "generatedAt": "2026-07-24T10:10:00Z",
  "summary": "Extended the Playwright suite with a checkout spec and a reused page object.",
  "classification": "extended",
  "confidence": 0.9,
  "evidence": [
    { "type": "context", "description": "Context records testFramework.e2e: playwright", "source": ".qa/context.md" },
    { "type": "file", "description": "Reused existing LoginPage page object", "source": "tests/pages/login.page.ts" }
  ],
  "framework": { "name": "playwright", "mode": "extend" },
  "generatedFiles": [
    { "path": "tests/checkout.spec.ts", "purpose": "Checkout happy-path spec", "category": "test" }
  ],
  "modifiedFiles": [],
  "skippedFiles": [
    { "path": "tests/pages/login.page.ts", "reason": "exists-reused", "detail": "Reused rather than regenerated." }
  ]
}
